<?xml version="1.0" encoding="UTF-8"?>
<!--<!DOCTYPE mappings SYSTEM "http://www.dcits.com/xml/dtd/parserMapping.dtd">-->
<mappings useMapping="">
    <baseDefine id="json2mapByMapping">
        <globalMappingId>global</globalMappingId>
        <mappingIdSpel>[in][SYS_HEAD][SERVICE_CODE]+'-'+[in][SYS_HEAD][MESSAGE_TYPE]+'-'+[in][SYS_HEAD][MESSAGE_CODE]]</mappingIdSpel>
    </baseDefine>
    <baseDefine id="json2mapMapping">
        <globalMappingId>global</globalMappingId>
        <mappingIdSpel>[in][SYS_HEAD][SERVICE_CODE]+'-'+[in][SYS_HEAD][MESSAGE_TYPE]+'-'+[in][SYS_HEAD][MESSAGE_CODE]]</mappingIdSpel>
    </baseDefine>
    <mapping id="global">
        <in ref="[in]"><!--输入数据映射-->
            <map name="SYS_HEAD" ref="[in][SYS_HEAD]">
                <item name="TRAN_TIMESTAMP">T(com.dcits.galaxy.base.util.DateUtils).getDateTime()</item>
            </map>
        </in>
        <out ref="[out]">
            <map name="SYS_HEAD" ref="[out][SYS_HEAD]">
                <item name="TRAN_TIMESTAMP">T(com.dcits.galaxy.base.util.DateUtils).getDateTime()</item>
            </map>
        </out>
    </mapping>
</mappings>